Id,Name,Description,Message,LogicType,Logic,Stage,Docket,EmrSystemId
d05864e8-678a-11eb-ae93-0242ac130002,AppVersion,DWAPI Application Version,You are using the latest version of DWAPI|You are using an outdated version of DWAPI. Please update your software to the latest version {1},1,3.0.0.3,0,NDWH,a6221856-0e85-11e8-ba89-0ed5f89f718b
d0586c5e-678a-11eb-ae93-0242ac130002,EMR_ETL_Refresh,Last EMR ETL Refresh date,Your last EMR refresh date was {1} days ago|Please refresh your ETL Tables before loading the data. It has been {1} days since you last refreshed them.,3,5,0,NDWH,a6221856-0e85-11e8-ba89-0ed5f89f718b
d0586d6c-678a-11eb-ae93-0242ac130002,TX_CURR,Current on ART,Your current on ART is {0}|Your current on ART is <0. Please confirm that you are loading a recently updated database,2,0,0,NDWH,a6221856-0e85-11e8-ba89-0ed5f89f718b
d0586e3e-678a-11eb-ae93-0242ac130002,LAST_ENCOUNTER_CREATE_DATE,Last EMR Encounter create date,Your last EMR encounter date was {1} days ago|You may be uploading an old database. The last EMR encounter create date is {1} days ago. Please confirm you have the latest database. ,3,5,0,NDWH,a6221856-0e85-11e8-ba89-0ed5f89f718b
d0586f06-678a-11eb-ae93-0242ac130002,LastLoginDate,Last EMR Login date,Your last EMR log in date was {1} days ago|You may be uploading an old database. Your last log in was on {1} days ago. Please confirm you have the latest database.,3,365,0,NDWH,a6221856-0e85-11e8-ba89-0ed5f89f718b
d0586f07-678a-11eb-ae93-0242ac130002,MFL_CODE,MFL Codes in the database,Your MFL code is {0}|The MFL on this database has been recently changed. The codes present in your database are {0} please contact help desk for further assistance.,4,1,0,NDWH,a6221856-0e85-11e8-ba89-0ed5f89f718b
